	Title	Description	Eng Title	Eng_Des	URL
0	DIRECT. Incendies : plusieurs entreprises prennent des mesures pour libérer leurs employés pompiers volonta...	Carrefour, Orange, EDF et GRDF vont augmenter le nombre de jours de détachement accordés aux salariés pompiers volontaires.	DIRECT. Fires: Several companies are taking measures to free their firefighters voluntarily...	Carrefour, Orange, EDF and GRDF will increase the number of days of deployment for volunteer firefighters.	https://www.francetvinfo.fr/faits-divers/incendie/direct-incendies-plusieurs-brasiers-toujours-en-cours-vendredi-qui-sera-la-journee-la-plus-chaude-de-la-semaine_5305195.html
1	EN IMAGES. Neuf photos marquantes de la sécheresse qui frappe la France	Un pic de canicule est attendu, ce vendredi 12 août, sur la France avec des températures entre 38 et 41 °C. Cette troisième vague de chaleur depuis le début de l’été ne vient que renforcer une situation de sécheresse qui touche tout le pays. Comme le montrent…	IMAGES: Nine striking photos of the drought in France	On Friday, August 12, a peak of cannibalism is expected in France, with temperatures ranging from 38 to 41 °C. This third wave of heat since the beginning of summer has only strengthened a situation of drought that affects the whole country.	https://www.ouest-france.fr/meteo/secheresse/en-images-neuf-photos-marquantes-de-la-secheresse-qui-frappe-la-france-da765072-1a15-11ed-8820-6f9a2d1450d7
2	La forêt de Brocéliande touchée par un incendie	230 hectares ont brûlé en forêt de Brocéliande, ou forêt de Paimpont. Le feu est maîtrisé, selon les pompiers.	Brocéliande forest affected by fire	230 hectares of Brocéliande forest, or Paimpont forest, have been burned and fire is controlled, according to firefighters.	https://www.huffingtonpost.fr/environnement/article/un-incendie-touche-la-foret-de-broceliande-en-bretagne_206508.html
3	"Le ministre américain de la Justice dit avoir ""personnellement approuvé"" la perquisition chez Donald Trump"	"Merrick Garland a demandé à lever la confidentialité du mandat ayant permis cette opération, au vu de ""l'intérêt public important"" pour cette affaire."	"U.S. Justice Minister Says He ""Personally Approved"" Donald Trump Search"	"Merrick Garland requested that the confidentiality of the mandate granting this operation be lifted, in view of the ""significant public interest"" in this case."	https://www.francetvinfo.fr/monde/usa/presidentielle/donald-trump/le-ministre-americain-de-la-justice-dit-avoir-personnellement-approuve-la-perquisition-chez-donald-trump_5305366.html
4	Gironde, Jura, Bretagne… Le point sur les principaux incendies en France ce vendredi	De nombreux incendies sont en cours ce vendredi 12 août. Les feux sont disséminés un peu partout en France, de la Gironde au Jura, en passant par la Bretagne ou encore l’Ardèche. Des milliers de pompiers sont actuellement mobilisés pour y faire face. On fait …	Gironde, Jura, Brittany... The main fires in France this Friday	Many fires are under way this Friday 12 August. The fires are spreading across France, from the Gironde to the Jura, through Brittany or the Ardèche. Thousands of firefighters are currently mobilised to deal with them.	https://www.ouest-france.fr/faits-divers/incendie/gironde-jura-bretagne-le-point-sur-les-principaux-incendies-en-france-ce-vendredi-86d143fc-19ff-11ed-8820-6f9a2d1450d7
5	Le taux de chômage en France quasiment stable au 2e trimestre, à 7,4%, selon l'Insee	Au deuxième trimestre, le nombre de chômeurs au sens du Bureau international du travail (BIT) atteint 2,3 millions de personnes, soit 29 000 de plus sur trois mois.	The unemployment rate in France remained almost stable in the second quarter, at 7.4%, according to Insee	In the second quarter, the number of unemployed within the meaning of the International Labour Office (ILO) reached 2.3 million people, or 29,000 more in three months.	https://www.francetvinfo.fr/economie/emploi/chomage/le-taux-de-chomage-en-france-quasiment-stable-au-2e-trimestre-a-7-4-selon-l-insee_5305243.html
6	DIRECT. Guerre en Ukraine : la Russie ne soutient pas la création d'une zone démilitarisée autour de la centrale de Zaporijjia	L’agence internationale de l’énergie atomique et l’ONU demandent expressément de libérer la zone, sous contrôle russe depuis le mois de mars	Direct. War in Ukraine: Russia does not support the creation of a demilitarized zone around the Zaporizhia plant	The International Atomic Energy Agency and the United Nations expressly call for the freeing of the zone, which has been under Russian control since March.	https://www.leparisien.fr/international/direct-guerre-en-ukraine-fortes-inquietudes-autour-de-la-centrale-nucleaire-zaporijjia-visee-par-des-frappes-12-08-2022-M7GXIJOSXVGVJKF4C7EFPXLLZI.php
7	Alerte canicule : 19 départements en vigilance orange, 40 en jaune, les prévisions de ce vendredi brûlant	Ce vendredi 12 août, l'épisode de canicule va s'intensifier et atteindre son apogée. C'est toute la moitié ouest de la France qui sera concernée par des températures très élevées. Localement la barre des 40°C pourra être dépassée.	Canine Alert: 19 departments in orange, 40 in yellow, forecasts for this burning Friday	This Friday 12 August, the canine outbreak will intensify and reach its peak. The whole of western France will be affected by very high temperatures.	https://www.midilibre.fr/2022/08/12/alerte-canicule-19-departements-en-vigilance-orange-40-en-jaune-les-previsions-de-ce-vendredi-brulant-10485190.php
